[
  {
    "name": {"first": "Valtid", "last": "Caushi", "middle":"Xhemil"},
    "location": "London",
    "dob": "31/06/1988",
    "likes": 0,
    "image":"http://placehold.it/90x90?2"
  },
  {
    "name": {"first": "Thomas", "last": "McKiernan"},
    "location": "Paris",
    "dob": "31/06/1988",
    "likes": 5,
    "image":"http://placehold.it/90x90?3"
  },
  {
    "name": {"first": "Mario", "last": "Contessa"},
    "location": "Rome",
    "dob": "31/06/1988",
    "likes": 2,
    "image":"http://placehold.it/90x90?4"
  },
  {
    "name": {"first": "Gopi","middle":"", "last": "Selva"},
    "location": "Mumbai",
    "dob": "31/06/1908",
    "likes": -11,
    "image":"http://placehold.it/90x90?4"
  }
]
